text,Category
Nissan Says All New Vehicles in Key Markets to Be Electrified by Early 2030s Nissan Motor Co said on Wednesday that all of its new vehicle offerings in key markets will be electrified by,business
"Naomi Campbell in Lagos for ARISE FASHION WEEK, Dedicated to Exposing Fresh African Talent to the World Supermodel and businesswoman Naomi Campbell is in Lagos, Nigeria’s commercial capital, for Arise Fashion Week, an event she’s backed since",entertainment
"Hollywood Film-Crew Union Reaches Tentative Deal, Averting Strike A union that represents about 60,000 behind-the-scenes workers in film and television reached a tentative deal with producers on Saturday,",entertainment
"Nigeria: Central Bank Chief Emefiele to Address Maiden Non-Oil Exports Summit The Governor of the Central Bank of Nigeria (CBN), Mr. Godwin Emefiele would address the maiden summit on Non-oil Exports",business
"Nigeria: Like Rivers, Lagos Seeks Law to Commence VAT Collection Just like Rivers State in the Niger-Delta which recently enacted its Value Added Tax (VAT) Law 2021 to regulate the",politics
"Nigeria: Nothing will Bring Me Back to Partisan Politics, Obasanjo Tells PDP Leaders Former President Olusegun Obasanjo on Saturday restated his vow not to return to partisan politics. Obasanjo, 84, made this known",politics
Rakitic Scores as Sevilla Beat Barca in Copa Semi-final Sevilla's Jules Kounde scored a fine goal and Ivan Rakitic struck against his old side as Barcelona lost their Copa,sports
"Sony, Honda Team Up to Develop and Sell Electric Cars Japan's Sony Corp and Honda Motor Co Ltd said on Friday they would pair up to develop and sell battery-powered",tech
Tottenham Confirms Ryan Mason as Interim Head Coach With Julian Nagelsmann Targeted as Mourinho’s Successor Ryan Mason will lead boyhood club Tottenham out at Wembley on Sunday after being named interim head coach until the,sports
Japan’s Hayabusa2 Space Probe Delivers Rock Samples from Asteroid Ryugu Japan’s space agency has retrieved a capsule carrying the first rock samples from beneath the surface of an asteroid that,tech
"Nigeria: Judgement on VAT Will Strengthen Campaign for Restructuring, Falana Says Nigerian human rights lawyer, Mr. Femi Falana, on Sunday, said the judgement of the Federal High Court in Port Harcourt,",business
Euro 2020: Lewandowski’s Superb Header Helps Poland Draw With Spain Spain were again haunted by their inability to finish off chances as they drew 1-1 with Poland on Saturday after,sports
"Netflix Launches First Games on Smartphones Netflix is launching its first games worldwide as it seeks to break into the game subscription market. Starting Tuesday, the",business
"‘Extraordinary Year’: Twitter Posts Record Revenues in Q4 2020 Twitter has posted record revenues for the last quarter of 2020, capping off what its chief executive said was ""an",tech
Final Trump-Biden Debate on Thursday to Feature ‘Mute’ Button as US Election Race Enters Last Lap The final debate between US President Donald Trump and Democratic rival Joe Biden will feature a mute button to allow,politics
"Nigeria: APC Governors Divided Over National Convention, Choice of Consensus The forthcoming convention of Nigeria's All Progressive Congress (APC) has split governors elected under the political party into three different",politics
"Nigeria: Campaign Group Rallies Support for Emefiele Presidency in Nasarawa The Unified Northern Nigeria Youth Forum (UNNYF), which is advocating that Governor of the Central Bank of Nigeria (CBN), Dr.",politics
Egypt Plans High-tech Leap With New ‘Smart City’ Capital Egypt is planning a new high-tech leap with its new capital on the outskirts of Cairo. Citizens will use smart,tech
Liverpool End Anfield Defeats With Dramatic Late Winner Against Aston Villa Liverpool dramatically snapped a six-game run of Premier League defeats at Anfield on Saturday with a 2-1 win against Aston,sports
"Nigeria: Buhari Reportedly Settles for Ex-Nasarawa Governor Adamu as Consensus Candidate for APC Chair Reports that President Muhammadu Buhari might have settled for a former governor of Nasarawa State, Senator Abdullahi Adamu, as his",politics
Euro 2020: Italy Overcome Austria in Extra Time to Reach Quarterfinals Federico Chiesa scored an extra-time goal as Italy beat Austria 2-1 in London to advance to the quarterfinals of the,sports
"Nigeria: Coalition of Northern Youth Groups Want CBN Governor Emefiele to Run for 2023 Presidency A coalition of 40 social cultural groups across the north, under the umbrella of “The unified Northern Nigeria Youths Forum”,",politics
"In Damning Verdict, Generating Companies Say Nigeria ‘Flogging a Dead Horse’ in Power Sector The electricity Generation Companies (Gencos) in Nigeria Thursday compared the federal government’s handling of the power sector to the case",business
"NASA Plans Two New Missions to Venus, the First in Decades NASA on Wednesday announced plans to launch two new scientific missions to Venus between 2028 and 2030 — its first",tech
"Osaka, Nadal Both Withdraws From Wimbledon The 2021 Wimbledon Championships will be without two of the world's best tennis stars after Naomi Osaka followed Rafael Nadal",sports
"Citing Increased Credit Exposure Risks, IMF Board Raises Reserve Target The Executive Board of the International Monetary Fund has agreed to raise the medium-term target for the fund’s precautionary reserves",business
"Davido Donates N250m to Orphanages, Sets up Five-man Committee for Disbursement Award-winning singer, David Adeleke, better known as ‘Davido,’ on Saturday set up a five-man committee to supervise the disbursement of",entertainment
Lagos Marriott Opens Spa The recently opened Lagos Marriott Hotel Ikeja has officially announced the grand launch of its Isade Spa. The hotel’s ultramodern,business
Nigeria: NNPC Completes Withdrawal of Dirty Fuel from Circulation The Nigerian National Petroleum Company Ltd (NNPC) has withdrawn all the methanol blended petrol which was imported into the country,business
Liverpool Beat Arsenal to Cut Man City’s Premier League Lead to One Point A clinical Liverpool beat Arsenal 2-0 to cut Manchester City's once double-digit lead at the top of the Premier League,sports
"Covid Case Counts May Be Losing Importance Amid Omicron: AP The explosive increase in U.S. coronavirus case counts is raising alarm, but some experts believe the focus should instead be",health
"The Rise Fund to Invest $200m in Airtel Africa’s Mobile Money Business Valued at $2.65bn Airtel Africa, a leading provider of telecommunications and mobile money services in fourteen countries across Africa, has announced the signing",business
US Suspects Russia of Hacking Government Agencies Hackers broke into the networks of federal agencies including the Treasury and Commerce departments in attacks revealed just days after,tech
"With All 18 LGAs’ Results Announced, Obaseki Wins 13, Ize-Iyamu 5 Peoples Democratic Party candidate in Edo State governorship election, Mr. Godwin Obaseki, has won in 13 local government areas, polling",politics
"FG Willing to Partner Investors on Power Supply, Says Minister The Minister of Power, Mr. Abubakar Aliyu, has disclosed that the federal government was willing to partner investors in the",business
"Airlines Worldwide Rush to Change Flights Over US 5G Dispute Airlines across the world, including the long-haul carrier Emirates, rushed Wednesday to cancel or change flights heading into the U.S.",business
Rewane: Buhari’s Leadership Style Delivering Poorest  Economic Outcomes Since 1999 Rewane made the evaluation in a presentation he made during the August edition of the monthly Lagos Business School’s Breakfast,business
"Nigerian Resident Doctors Suspend Nationwide Strike Two Months After Members of the National Association of Resident Doctors (NARD), have resolved to suspend their two months old industrial action. At",health
"IHS Towers to Become Largest African Company on Wall Street An African operator of mobile phone masts, IHS Towers might become the largest Africa-focused company on Wall Street if its",business
Nigeria Insists on Right to Produce Head of West African Gas Authority Nigeria's federal government has insisted that it wasn’t in breach of any part of the treaty setting up the West,business
US Signs MOU with NLNG to Make Bonny Island Malaria-free Zone Nigeria Liquefied Natural Gas Limited (NLNG) has signed a five-year Memorandum of Understanding (MOU) with two United States government development,health
England Beat San Marino 10-0 to Qualify for Qatar World Cup England hit double figures for the first time since 1964 as they secured qualification for the 2022 World Cup in,sports
Griezmann: Barcelona’s Defeat by Juve Wake-up Call Barcelona forward Antoine Griezmann believes his side's 3-0 defeat by Juventus in the Champions League could be just what his,sports
Stakeholders Foresee Growth Opportunities in Nigerian Stock Exchange’s Demutualisation Stakeholders in Nigeria’s capital market have hailed the final approval given by the Securities and Exchange Commission (SEC) and the,business
Nigeria: Presidency Says Opposition PDP Not in Position to Win 2023 Elections Nigeria’s Presidency Tuesday ruled out the possibility of the opposition Peoples Democratic Party (PDP) winning the 2023 presidential election in,politics
"Nigeria: Leading Socio-cultural Groups Back Reps’ Summon of President Buhari The pan-Yoruba socio-cultural group, Afenifere, Northern Elders Forum (NEF) and the Civil Society Legislative Advocacy Centre (CISLAC) are three notable",politics
"Israeli Spyware Used to Target Journalists and Activists Worldwide, Report Says Activists, politicians and journalists from around the world were targeted in a surveillance operation using software sold by the Israeli",tech
"French Champions PSG Sack Tuchel, Pochettino Favourite to Take Charge French Ligue 1 champion Paris Saint Germain have sacked their manager Thomas Tuchel, multiple news outlets are reporting. Tuchel took charge of",sports
"China Will ‘Eat Our Lunch,’ Biden Warns After Clashing with Xi on Most Fronts US President Joe Biden and his Chinese counterpart Xi Jinping held their first phone call as leaders and appeared at",politics
"Nigeria Challenges Indigenous Oil Firms to Fill Void Created by Divesting IOCs Deputy Oil Minister Sylva says investors should perceive the IOCs’ divestments as opportunities, rather than threats.Read more",business
"Chelsea, Sevilla Reach UEFA Champions League Last 16 Chelsea reached the last 16 of the UEFA Champions League on Tuesday after a late Olivier Giroud strike gave the",sports
"Indonesia Blocks Yahoo, Paypal, Gaming Websites Over Licence Breaches Under rules released in late November 2020, authorities have broad powers to compel platforms to disclose data of certain users",tech
"INEC: Ekiti, Osun Elections Have Prepared Us Better for 2023 Barely 24 hours after the suspension of voter registration, INEC disclaimed a site that claimed to be continuing with the",politics
"Ethereum Breaks Past $3,000 to Quadruple in Value in 2021 Cryptocurrency ether broke past $3,000 on Monday to set a new record high in a dazzling rally that has outshone",business
"Nigeria: Electoral Chairman Worries Over Safety of Staff and Voters During Anambra Poll Chairman of the Independent National Electoral Commission (INEC), Professor Mahmood Yakubu, on Tuesday, painted a rather disturbing situation report on",politics
"Shell, Eni Declare Force Majeure After Attacks on Oil Facilities in Niger Delta Shell Plc and Eni SpA both declared force majeure on key oil flows from Nigeria, threatening to disrupt supplies in",business
"Elon Musk’s Starlink Gets ISP Licence to Operate in Nigeria The world’s richest man, Elon Musk has revealed that the Nigerian Communications Commission (NCC) has issued its firm, Starlink Internet",tech
Lagos Marriott Appoints Van Rensburg as General Manager The Lagos Marriott Hotel Ikeja has announced the appointment of Rudi Janse Van Rensburg as General Manager. Van Rensburg arrives,business
Benzema Double Helps Real Madrid into Champions League Last 16 Two headed goals from Karim Benzema helped Real Madrid reach the Champions League knockout stages with a convincing 2-0 home,sports
"West Eases Efforts to Restrict Russian Oil Trading as Inflation and Energy Risks Mount European firms will now not be blocked from paying the likes of Rosneft, “if these transactions are strictly vital.”Read more",business
"Tinubu is Cornered, He’s Taken Sides Against Christians, Says Former SGF Babachir Lawal A former Secretary to the Government of the Federation, Babachir Lawal on Tuesday, wrote a letter to his friend and",politics
"Nigeria: Kano Governor Ganduje ‘Resolves’ Dispute Between Dangote, BUA Groups Kano State Governor, Dr Abdullahi Ganduje, has resolved the dispute between the Dangote Group and BUA Group, owned by two",business
"Cuba Economy Suffering under Tightened US Embargo, Foreign Minister Says Cuba's Foreign Minister said on Thursday that the US government has taken advantage of the coronavirus pandemic and ""tightened the",politics
"Naira Strengthens, as Bank CEOs Pledge Support for New CBN FX Policy The naira appreciated to N520 to a dollar on the parallel market on Thursday, stronger than the N525 to a",business
"Russia Edges Japan, China for Gold in Men’s Gymnastics Nikita Nagornyy huddled with the rest of the Russian men’s gymnastics team, stared at the scoreboard and waited. And waited.",sports
"US Election: Nigerian-born Democrat Adelewa Elected Shadow US Rep Nigerian born Democrat, Adeoye Owolewa has been elected a shadow United States Representative out of the District of Columbia, with",politics
"Buhari Making Grazing Routes and Reserves Conditions for Peace, Benue Governor Ortom Claims Benue State Governor, Samuel Ortom, has said the dispositions of President Muhammadu Buhari, were beginning to confirm insinuations that he",politics
Manchester City Stroll into Champions League Quarterfinals With Comfortable Win Over Monchengladbach Manchester City marched into the quarterfinals of the Champions League for the fourth straight season after a 2-0 win over,sports
"Trump Claims Credit as Republicans Capture Virginia Governorship, Dealing Blow to Biden Republicans won the Virginia governor’s election and were within striking distance in New Jersey on Wednesday, a warning that President",politics
"US Oil Majors Chevron, Exxon Shrink Spending as Coronavirus Cuts Demand US oil majors Chevron Corp and Exxon Mobil cut spending aggressively in the third quarter in a race to offset",business
"Arthur Nzeribe, Founder of Infamous Association for Better Nigeria, is Dead Senator Arthur Nzeribe, infamous for the Association for Better Nigeria (ABN), the mastermind of June 12 annulment is dead. He",politics
"Bayern Outlast Stubborn Sevilla, Win UEFA Super Cup Javi Martinez scored the winner in extra time to give Bayern Munich a 2-1 victory over Sevilla in the UEFA",sports
Officials in Tokyo Alarmed as Covid Cases Hit Record Highs Japanese officials sounded the alarm Thursday after Tokyo reported record-breaking coronavirus cases for two straight days with the Olympics well,sports
"Facebook Plans to Hire 10,000 in EU to Build ‘Metaverse’ Facebook Inc (FB.O) plans to hire 10,000 in the European Union over the next five years, the social media giant",tech
"Despite Being Banned in Nigeria, Twitter Records $1.28bn Revenue Increase In Q3 2021 Despite Twitter ban in Nigeria, the platform recorded $1.28 billion in revenue for the third quarter of 2021, representing a",tech
Covid Vaccine: Eight-week Gap Seen as Sweet Spot for Pfizer Jab Antibodies A longer gap between first and second doses of the Pfizer-BioNTech Covid vaccine makes the body's immune system produce more,health
"Nigeria Spends $2bn on Wheat Importation Annually, Central Bank Says The Central Bank of Nigeria (CBN) on Sunday revealed that the importation of wheat costs the country about $2 billion",business
"‘Liar’: Tinubu Says Atiku Offered Him VP Ticket in 2007, Atiku Dares Tinubu to Appear for TV Interview Atiku earlier said he rejected Tinubu as his running mate in 2007 because of his aversion to a Muslim-Muslim ticket.Read more",politics
"Donald Trump Sues Hillary Clinton Over Russian Collusion Allegations Former US President Donald Trump has sued Hillary Clinton and several other Democrats, accusing them of trying to rig the",politics
Israel Targeting Hamas Cryptocurrency Accounts Israel has said it will begin seizing cryptocurrency accounts used by the Palestinian Hamas group to raise money for its,business
"Nigeria: To Allow Limitless Loan Recovery, CBN Amends Operational Guidelines of Global Standing Instruction The Central Bank of Nigeria (CBN) has amended the operational guidelines of the Global Standing Instruction (GSI) to allow for",business
Nigeria’s Marginal Fields: NUPRC Invites Reserve Bidders after Winners Fail to Pay Within Stipulated Time The Nigerian Upstream Petroleum Regulatory Commission (NUPRC) on Monday invited reserve bidders for the 2020 marginal fields programme completed in,business
"Americans Could Get Covid-19 Vaccine as Early as December 11, Herd Immunity Possible By May The first batch of Americans to receive a Covid-19 vaccine could get them as soon as December 11, according to",health
"Chelsea, Man City Fans Involved in Violent Clashes in Porto Ahead of Champions League Final English fans descending on Porto for the Champions League final were involved in violent clashes on Thursday night, the UK",sports
"Diddy Launches Black Political Party With less than three weeks until the US election, Sean ‘Diddy’ Combs has launched his own political party. “I’m launching",politics
Man City 5-0 Arsenal: Cityzens Crush Hapless 10-man Gunners Manchester City put a difficult week behind them by cruising to a 5-0 victory over 10-man Arsenal on Saturday. The,sports
"US, UN Demand Proof of Missing Chinese Tennis Star Peng Shuai Wellbeing The UN and the United States on Friday demanded proof of Peng Shuai’s whereabouts, amid rising concern for the Chinese",sports
Olympic Athletes to Put on Own Medals at Tokyo Ceremonies Athletes at the Tokyo Olympics will put their medals around their own necks to protect against spreading the coronavirus. The,sports
"Shell Rattled By Bank Accounts  Restrictions, as Aiteo Seeks $4bn for ‘16 Million Barrels of Crude Diverted’ There are strong indications that Tuesday’s injunction of a Federal High Court, Lagos, barring Royal Dutch Shell’s Nigerian subsidiary from",business
"Price of Rice, Other Food Items to Crash Soon, Buhari Assures President Muhammadu Buhari has assured Nigerians that prices of food items, especially rice will soon come down. The president, who",business
"Sheffield  United Part Ways with Manager Chris Wilder Christopher Wilder has left his role as manager of Sheffield United after nearly five years in charge, with Paul Heckingbottom",sports
"Haiti President Jovenel Moïse Assassinated at Home Haitian President Jovenel Moïse was assassinated in an attack on his private residence, the country’s interim prime minister said in",politics
"Venezuela Introduces New Currency, Drops Six Zeros Venezuela is set to debut a new currency that will feature six fewer zeros, a response to years of some",business
"Hollyfrontier to Acquire 97-year-old 115,000bpd Refinery for $2.6bn As the Nigerian National Petroleum Corporation (NNPC) targets to acquire a 20 per cent stake, translating to 130,000 barrels per",business
"UK Tops 50,000 Coronavirus Deaths as Italy Reaches One Million Infections The United Kingdom has surpassed 50,000 deaths linked to COVID-19, with a recent rise in infections leading to a new",health
"China-US Confrontation a Disaster for Both Countries, Xi tells Biden Confrontation between China and the United States would be a disaster and the two sides should re-establish the means to",politics
"Nokia to Stop Doing Business in Russia Telecoms equipment maker Nokia is pulling out of the Russian market, its CEO told Reuters, going a step further than",business
Nigeria’s Auditor General Reveals 107 Million Barrels of Crude Oil Missing in 2019 The audit report of the Auditor General for the Federation has revealed that the defunct Nigeria National Petroleum Company (NNPC),business
Igbo Socio-Cultural Group Ohanaeze Optimistic of Peter Obi’s Victory in 2023 Chief Damian Okeke –Ogene on Thursday said the group was confident of Obi's victory in 2023.Read more,politics
"Governing APC Plans to Rule Nigeria for 32 Years, Yobe Governor Buni Says Chairman of the National Caretaker/Extraordinary Convention Planning Committee of the All Progressives Congress (APC), Mr. Mai Mala Buni, Tuesday unfolded",politics
Moderna Launches Clinical Trials for HIV Vaccine Human clinical trials have started for an experimental HIV vaccine that uses the same kind of mRNA technology found in,health
Confident Super Eagles Land in Cape Verde for Qatar 2022 Qualifier The Super Eagles’ contingent for Tuesday’s FIFA World Cup Qatar 2022 qualifying tango with the Blue Sharks of Cape Verde,sports
Egypt’s Al Ahly Beat Kaizer Chiefs 3-0 to Win Record Tenth African Crown Egyptian heavyweights Al Ahly beat Kaizer Chiefs 3-0 in Morocco on Saturday night to become the first side in history,sports
"Global Financial Crisis Looms as US Risks Defaulting on National Debt The global financial market may be heading towards an imminent crisis, as the United States is currently facing the risk",business
"Nigeria: INEC Suspends Registration in lmo as Gunmen Invade Centre, Kill Staff Nigeria's Independent National Electoral Commission (INEC), has suspended the Continuous Voter Registration Exercise (CVR) exercise in Ihitte Uboma Local Government",politics
"President Buhari, Vice President Osinbajo to Receive Covid-19 Vaccine on Live TV Plans are being made for the Nigerian President Muhammadu and Vice President Yemi Osinbajo to receive the COVID-19 vaccine on live",health
"Djokovic to Face Olympic Champion Zverev in US Open Semi-finals Never fazed, rarely flummoxed, Novak Djokovic is so collected in best-of-five-set matches — even when falling behind, as he has",sports
"China in Talks with WHO over its Locally-produced COVID-19 Vaccines China is in talks to have its locally-produced COVID-19 vaccines assessed by the World Health Organization, as a step toward",health
"Nigeria Better as One, Governing Party Stalwart Tinubu Tells Secession Agitators National Leader of the All Progressives Congress (APC), Senator Bola Tinubu, has called on those clamouring for secession to jettison",politics
Osun Election: PDP’s Adeleke Challenges Incumbent APC Governor Oyetola Osun State will Saturday decide whether Gov. Oyetola APC should continue for another four years or elect a new man,politics
Zambian Opposition Leader Hichilema Wins By Landslide in Presidential Vote Zambian opposition leader Hakainde Hichilema secured a shock landslide victory in the nation’s presidential election. Electoral Commission of Zambia Chairman,politics
"As Fuel Queues Return, Nigeria’s State-owned Oil Company Cautions Against Panic Buying The Nigerian National Petroleum Corporation (NNPC) and the Independent Petroleum Marketers Association of Nigeria (IPMAN) have cautioned motorists against panic",business
"Health Officials Interrupt Brazil-Argentina World Cup Qualifier, Match Suspended A World Cup qualifier between Brazil and Argentina was suspended after Brazilian health officials objected to the participation of three",health
"Nigeria: Cross River Governor Ayade Suspends Calabar Carnival Over Insecurity, Omicron Gov. Ben Ayade of Cross River has suspended the 2021 annual Calabar carnival due to insecurity and the outbreak of",entertainment
Chelsea Go Top of Premier League With 3-1 Win Over Leeds Fans returned to Stamford Bridge just in time to see Chelsea go top of the Premier League as they came,sports
Crystal Palace Star Zaha Becomes First Premier League Player Not to Take a Knee Before Match Wilfried Zaha has become the first Premier League player not to take a knee before a match since the gesture,sports
"Instagram, Facebook, WhatsApp Apps Crash Throughout the World Facebook Inc's main social media site, popular photo-sharing platform Instagram and messaging app WhatsApp, were down for tens of thousands of",tech
"La Liga President Tebas ‘Ready’ for Messi’s Departure From Spain La Liga president Javier Tebas says he is ""ready"" for the exit of Lionel Messi - while criticising Manchester City,",sports
"Pakistan PM Imran Khan Tests Positive for Covid-19 Pakistan Prime Minister Imran Khan has tested positive for Covid-19 two days after receiving his first vaccine dose. Khan, 68,",health
Juventus Present Ronaldo With G.O.A.T. 770 Shirt For Passing Pele’s Goal Mark Cristiano Ronaldo was presented with a special shirt by Juventus president Andrea Agnelli ahead of Sunday's Serie A game against,sports
"Nigeria: Apapa Traffic Gridlock May Hurt AfCFTA’s Gains, Operators Warn Some members of the organised private sector (OPS) have decried the lack of political will to address the perennial traffic",business
Nigeria Vaccinates 3.6 Million Citizens Against Covid-19 Nigeria’s federal government on Tuesday put the total number of eligible Nigerians that have so far received their first dose,health
"US: Deadline Passes for ByteDance to Restructure TikTok, Talks to Continue The Trump administration on Friday opted not to grant ByteDance a new extension of an order requiring the Chinese company",business
