text,Category
Whyte Avenges Defeat with Knockout Win Over Povetkin in Gibraltar Rematch Dillian Whyte kept alive his hopes of a heavyweight world title shot by emphatically gaining revenge over Alexander Povetkin with,sports
ARISE Fashion Week 2020: Selection Committee for ‘30 Under 30’ Begins Africa’s Biggest Talent Hunt The 30 young and promising new designers ready to take on a post-Covid world are now being curated and will,entertainment
US Senate Passes Republican Bill to Overturn Biden Vaccine Mandate The Democratic-controlled U.S. Senate on Wednesday approved a Republican measure that would overturn President Joe Biden’s COVID-19 vaccine-or-test mandate for,politics
"Busta Rhymes Releases First Album in Eleven Years Influential veteran rapper Busta Rhymes has released his first studio album in more than a decade. The album, ‘Extinction Level",entertainment
"Fury v Wilder III: Rescheduled Fight Confirmed for October 9 Tyson Fury's third world heavyweight title fight against Deontay Wilder has been rescheduled for 9 October. The bout, which had",sports
"Shettima as Running Mate: APC Governors Displeased as Tinubu Says Spirit of 1993 Upon Us in 2023 Presidential candidate of the APC Bola Tinubu, on Sunday, announced former governor of Borno State and serving Senator Kashim Shettima",politics
"Lionel Messi Wins Record Seventh Ballon d’Or Some of the most illustrious names in soccer’s long history only managed to win the Ballon d’Or, the sport’s most",sports
"Belgium ‘Could Be Overwhelmed’ By New Coronavirus Infections, Health Minister Says Belgium could soon be overwhelmed by new coronavirus infections, the health minister has warned, amid soaring case numbers across the",health
"Buhari Signs Nigeria’s 2022 Budget, to Seek Amendment Due to ‘Worrisome Changes’ By Parliament Nigeria President Muhammadu Buhari Friday in Abuja signed into law the 2022 Appropriation Bill and the 2021 Finance Bill. The",politics
"Congo’s Sassou Wins Election By Landslide, Extends 36-Year Reign as President Congo Republic President Denis Sassou Nguesso has been re-elected with more than 88% of the vote, official results showed on",politics
"Nigeria Deliberating on How to Pay for Covid Vaccines, Requires $1bn to Inoculate 70% of Population Nigeria’s federal government is working out how to pay for Covid vaccines, the Minister of State for Budget and National",health
Chinua Achebe’s ‘Things Fall Apart’ and Sequels to be Adapted for Television The family of renowned Nigerian author Chinua Achebe has signed up with some production houses to adapt three of his,entertainment
"Enrique Backs Ramos after Missing Two Penalties against Switzerland Spain Head Coach, Luis Enrique, has jumped to the defence of record-breaker Sergio Ramos, who missed a pair of penalties",sports
Aubameyang Penalty Lifts Arsenal over Man United Pierre-Emerick Aubameyang's second-half penalty gave Arsenal their first Premier League away win over Manchester United since 2006. Aubameyang ended a,sports
"Malawi’s Ex-Deputy Speaker Shoots Himself Dead in Parliament A former deputy speaker in Malawi has shot himself dead inside parliament in the capital, Lilongwe, authorities said. Clement Chiwaya,",politics
Nigeria Grants NLNG $52m Tax Waiver for Bodo Bridge Construction Nigeria’s federal government has granted the Nigeria LNG Limited N20 billion (about $52m) in tax waiver for the construction of,business
"It’s Official, Barcelona Sign Sergio Aguero Barcelona have completed the signing of Sergio Aguero on a free transfer, following the end of his contract with Manchester",sports
"Google Doodle Honors Legendary Nigerian Musician Oliver De Coque On 74th Birthday Legendary Nigerian guitarist and highlife musician, Oliver De Coque, has been honoured with Google Doodle on his 74th posthumous birthday.",entertainment
Nigerian League Gets New Commencement Date The Nigerian government through the country's Ministry of Youth and Sports has announced a new date for the restart of the 2020/21,sports
Jamie Vardy’s Equaliser Ends Man. United Superb Run of Away Wins in Boxing Day Cracker Manchester United’s remarkable run of away victories came to an end as they missed the chance to go second in,sports
"Yara Shahidi Will Be First Black Tinker Bell in Disney’s Peter Pan Remake Rita Osakwe US actress Yara Shahidi has been cast as Tinker Bell in Disney's live-action Peter Pan movie, Peter Pan",entertainment
"FIFA Launches FIFA+ to Bring Free Football Entertainment to Fans Everywhere FIFA is excited to announce the launch of FIFA+, a world-class digital platform created to connect football fans across the",sports
"US Retail Sales Beat Expectations in September US retail sales rose more than expected in September, rounding out a strong quarter of economic activity, but the recovery",business
"Pogba Says Manchester United Can Win Premier League, Despite Not Being at Liverpool’s Level Yet Manchester United star Paul Pogba has admitted the club are not at the same level as Premier League champions Liverpool just yet, ahead",sports
Man City Restore Title Gap on Rivals With Comfortable Win Over Burnley Manchester City have restored a three-point gap at the top of the Premier League as they beat Burnley 2-0 for,sports
"PSG Face Barcelona, Chelsea Handed Tough  Atletico Tie in Champions League Round of 16 Premier League champions Liverpool and Chelsea were both handed tough ties as the draw was made for the last-16 of",sports
"MTN To Make Up For Network Disruption By Extending Users’ Time-Bound Subscriptions As a way of paying back the network disruption experienced by users on Saturday, MTN Nigeria says it will extend",business
"Nigeria: Parliament to Rework, Pass Electoral Bill Wednesday, Senate President Lawan Says President of Nigeria's Senate, Dr. Ahmad Lawan, has hinted that the National Assembly was ready to rework and pass the",politics
Glycemic Index and Why It’s an Important Factor in Meal Planning The glycemic index was designed for diabetics in the early 1980’s as a ranking system for carbohydrates based on their,health
"Nigeria Takes Delivery of 700,000 Covid Vaccine Doses from UK About 700,000 COVID-19 vaccine doses donated by the United Kingdom (UK) have been received at the Nnamdi Azikiwe International Airport,",health
"Nigeria’s Ex-President Jonathan Left $28.6bn External Reserves, Aide Retorts Reno Omokri, an aide to former President Goodluck Jonathan, has refuted claims that the latter left behind funds that could",politics
"Nigeria: House Passes 2022 Budget, Raises Sum to N17tn The House of Representatives at plenary on Tuesday approved the sum of N17.127 trillion as budget for the 2022 fiscal",politics
"Victor Moses Joins Spartak Moscow on Loan Nigerian international, Victor Moses on THursday completed his switch to Russian club Spartak Moscow on a one year loan spell.",sports
"First Time in 22 Years of Democracy, Nigerian Senate Goes against Agreement Reached with Sitting President For the first time since the country returned to democracy in 1999, the Senate on Wednesday reneged on an agreement",politics
"Former Theranos CEO Holmes Convicted of Fraud and Conspiracy In a case that exposed Silicon Valley’s culture of hubris and hype, Elizabeth Holmes was convicted Monday of duping investors",tech
NNPC Wants to Acquire 20% Stake in $15bn Dangote Refinery The Nigerian National Petroleum Corporation (NNPC) has expressed interest in purchasing a 20 per cent minority equity stake in Dangote,business
"Nigeria Records 32 Deaths, 170 Cases of Lassa Fever in Three Weeks At least 32 people have died of Lassa fever since the beginning of the New Year, according to data from",health
Copa America: Neymar Inspires Brazil to 4-0 Win over Peru Neymar moved to within nine goals of Pele's all-time scoring record as Brazil eased past Peru to earn a second,sports
Twitter Sues Elon Musk to Force Him to Complete $44bn Acquisition Twitter Inc sued Elon Musk on Tuesday for violating his $44 billion deal to buy the social mediaRead more,tech
"US Sends Nearly 500 000 Covid Vaccine Doses to Rwanda The United States is sending nearly half a million doses of the Pfizer Covid-19 vaccine to Rwanda, including the first doses",health
"Tax War: Despite Losing in Court, Nigeria’s Inland Revenue Service Insists on  Collecting VAT The Federal Inland Revenue Service (FIRS) has directed taxpayers they must continue to comply with their Value Added Tax (VAT)",business
"Wakanda Forever: Nigeria’s Tems Stars on Black Panther Sequel Soundtrack with ‘No Woman, No Cry’ Marvel Studios on Saturday debuted the trailer for the blockbuster sequel, which is scheduled for a November 11 release.Read more",entertainment
"Low Cuts Five Players as Germany Prepare for Ukraine, Switzerland Germany coach Joachim Low on Thursday cut five players from his squad to face Ukraine and Switzerland in the Nations",sports
"Virgil Abloh, Artistic Director for Louis Vuitton and Off-White Founder, Dies of Cancer at 41 Louis Vuitton artistic director and Off-White founder Virgil Abloh died Sunday of cancer, according to a tweet by luxury group LVMH. He",entertainment
"Nigeria: Supreme Court Judgment in Ondo Governorship Sets Off Another Legal Crisis in APC With the congresses of the ruling All Progressives Congress (APC) slated to commence this weekend, Wednesday’s Supreme Court ruling in",politics
India Seizes $725m in Xiaomi Assets Over Illegal Remittances India said on Saturday it had seized $725 million from the local bank accounts of China's Xiaomi Corp (1810.HK) after,business
Wole Soyinka to Release First Novel in Almost 50 Years Legendary Nigerian Author Wole Soyinka is set to release his first novel in 48 years. Chronicles of the Happiest People,entertainment
Analysts Project $100 Supercycle for Oil Post-pandemic A steady rise in oil prices since late last year could presage a new ‘supercycle’ in oil as the world,business
"Barty Beats Collins to End 44-Year Wait for Home Australian Open Champion Ash Barty recovered from 5-1 down in the second set to win the Australian Open final 6-3, 7-6 (2) over",sports
"NNPC Pays $452.5m Cash Call Arrears to IOCs in One Year The Nigerian National Petroleum Company (NNPC) paid an additional cash call arrears of $452,535,270 to its joint venture (JV) partners",business
Nigeria’s Oil Production Dips by 56.5m Barrels in Six Months Nigeria's crude oil production dipped by a cumulative 56.559 million barrels in the first six months of 2021 compared with,business
"Nigeria: Senate Presses Buhari to Designate Bandits Terrorists as 43 Killed in Niger State Worried by the criminal activities of bandits in many parts of the country, Nigeria’s Senate on Wednesday asked President Muhammadu",politics
"Military ‘Repels’ Attack Near Somali Presidential Palace Militiamen  in Somalia have attacked army positions in the capital, Mogadishu, close to the Presidential Palace, the country's government has",politics
"Hyundai Motor to Replace Battery Systems in Costly Electric Car Recall Hyundai Motor Co will replace battery systems in some 82,000 electric vehicles globally due to fire risks, a problem which",business
"Nigeria Issues 5G Licence to MTN, Mafab Communications The Nigerian Communications Commission (NCC) has confirmed the issuance of final letters of award of the Fifth Generation (5G) Spectrum",tech
"Apple Delays Return to Office Indefinitely Apple Inc is delaying its return to office plans indefinitely, Bloomberg News reported, while the company said it has temporarily closed",tech
"Global Stocks Rise as Trump’s ‘Improving Health’ Calms Markets Stock markets rose on Monday on hopes that President Donald Trump could be discharged from hospital later in the day,",business
"Currency Printing: Nigeria’s Opposition PDP Demands Sack of Finance Minister For ‘Misleading Citizens’ Nigeria's main opposition political party, Peoples Democratic Party (PDP) has demanded the immediate sack of the country's minister of finance,",politics
"Nigeria Can Earn $20bn Annually from Oil Palm: Edo Governor Obaseki Edo State Governor, Mr. Godwin Obaseki, has reiterated the need for Nigeria to diversify its economy from crude oil, noting",business
Coronavirus: US Gives Full Approval for Antiviral Remdesivir US regulators have given full approval for the antiviral drug remdesivir to treat Covid-19 patients in hospitals. The US Food,health
"Chris Brown Hints At Possible Joint Project with Drake A Breezy and Drizzy collaborative album may have seemed far-fetched once upon a time, but in 2020, it sounds like",entertainment
Nigeria: South-East Leaders Resolve to End IPOB’s Sit-at-Home Order Leaders of the South East rose from an expanded security meeting Tuesday and resolved to do everything within the law,politics
BAT Kenya Names a Kenyan New MD British American Tobacco Kenya has named a Kenyan to head the cigarette-maker as it marks over 113 years in the market.,business
Nigeria: Former Senate President Saraki in EFCC Custody on Money Laundering Accusations A former president of Nigeria's Senate Bukola Saraki is presently in the custody of the Economic and Financial Crimes Commission,politics
"Nigeria: PDP Fixes National Convention For October 29-30 Nigeria's opposition People's Democratic Party (PDP) has submitted a tentative date of October 30-31st, 2021 for its national convention. The",politics
"Pinnick Restates NFF’s Support for Nigeria Pitch Awards President of the Nigeria Football Federation, Mr. Amaju Melvin Pinnick, restated the Federation’s support and endorsement for the Nigeria Pitch",sports
"The Batman, Dune Latest Films Postponed in Further Setback for Film Industry In a major reshuffling of its movie calendar, Warner Bros. has announced the postponement of some of its hotly-anticipated films,",entertainment
Japan’s Ex Foreign Minister Kishida to Become New PM Japan’s former Foreign Minister Fumio Kishida has won the governing party leadership election and is set to become the next,politics
"White House Chief of Staff Contracts COVID-19 White House chief of staff Mark Meadows, who has frequently appeared at public events without wearing a mask, has been",health
"Tesla Takes Another Step to India Launch Tesla has moved a step closer to its launch in India later this year by registering a company in the country,",tech
"Nigeria: NNPP’s Kwankwaso Confirms Possibility of Collaboration    with Obi’s Labour Party The presidential candidate of the New Nigeria Peoples Party (NNPP), Senator Rabiu Kwankwaso, on Saturday confirmed ongoing talks for a",politics
Premier League Spending Tops £1bn on Transfer Deadline Day But  Still Less Than Previous Year Cristiano Ronaldo completed his shock move back to Manchester United on transfer deadline day to help push Premier League clubs',sports
"‘We’re Trying to Convince Them’: Some British Athletes ‘Don’t Want Vaccine’ for Tokyo 2020 The head of the British Olympic Association (BOA) says the organisation is still ""trying to convince"" some athletes to have",sports
Premier League Champions Liverpool Slip to Offer Man. United New Year’s Boost Liverpool were left frustrated by a host of missed chances as they drew 0-0 at Newcastle United to round off,sports
"Film Crew Voiced Safety Complaints Before Fatal Baldwin Shooting Hours before actor Alec Baldwin fired a fatal gunshot from a prop gun that he had been told was safe,",entertainment
"Tinubu: I’m Still Searching for Running Mate Despite forwarding to the Independent National Electoral Commission (IENC), last week, the name of Ibrahim Kabir Masari from Katsina State",politics
"Duke of Hastings Not Returning for Season 2 of Hit Netflix Show ‘Bridgerton’ Actor Regé-Jean Page, who played popular character Simon Basset in Netflix's hit historical drama ‘Bridgerton' will not be reprising his",entertainment
Arsenal 3-1 Chelsea: Young Gunners Stun Blues in London Derby Arsenal stunned Chelsea with a 3-1 Boxing day victory over their London rivals to ease the pressure on Mikel Arteta.,sports
"Ghana’s Inflation Rate Falls to 10.4% in September According to figures released by Ghana’s Statistics office, inflation rate fell for a second month in a row to 10.4%",business
La Liga: Messi Nets Brace as Barcelona Go Third Lionel Messi scored twice as Barcelona beat Athletic Bilbao to go third in La Liga. Athletic took an early lead,sports
"Barcelona Sack Koeman as Head Coach, Offer Role to Xavi Barcelona have sacked Ronald Koeman as head coach following Wednesday's defeat at Rayo Vallecano, while Goal can confirm the role",sports
"Djokovic Likely to Skip Australian Open Over Vaccine Mandate, Says Father Novak Djokovic is unlikely to play at the Australian Open if rules on COVID-19 vaccinations are not relaxed, the world",sports
"Tesla Boss Musk Challenges UN Official on How Money Can Help Resolve World Hunger Elon Musk, the world’s richest man, challenged a United Nations official’s claim that just a small percentage of his wealth",business
"Raging Ex-Man United Team-mates Lukaku, Ibrahimovic Clash as Inter Prevail Over Milan in Coppa Zlatan Ibrahimovic clashed heads and rowed furiously with fellow ex-Manchester United striker Romelu Lukaku before seeing red in an astonishing",sports
"Rihanna Honoured as ‘National Hero’ of Barbados Rihanna smiled under her face mask as she heard her name called in the pre-dawn hours of Tuesday, but hesitated",entertainment
"Tinubu: My Comments in Ogun Lost in Translation, My Respect for President Buhari High, Unfailing The All Progressives Congress (APC) presidential aspirant and former governor of Lagos State, Bola Tinubu, on Friday moved fast to",politics
"Nigeria Activates $587m AfDB Facility for Technology, Creative Sectors The Buhari administration has commenced the process that will pump the technology, entertainment and creative sectors with over N240 billion",business
Juventus Will Be Expelled from Serie A If They Persist with Super League Serie A side Juventus faces being expelled from the Italian top league if they don't withdraw from the European Super,sports
"Biden Administration Will Appeal Lifting of Mask Mandate, If CDC Agrees U.S. President Joe Biden's administration said on Tuesday it would appeal a judge's ruling ending a mask mandate on airplanes",health
"Nigeria Suspends Sale, Registration of New SIM Cards The Nigerian Communications Commission (NCC) has directed mobile network operators to immediately suspend the sale and activation of new SIM",tech
US Rapper Bobby Shmurda Released from Prison US rapper Bobby Shmurda has been conditionally released from prison after almost five years behind bars. Shmurda’s conditional release means,entertainment
"Afreximbank to Deliver 40m J&J Covid Vaccines to Nigeria President of African Export-Import Bank (Afreximbank), Prof. Benedict Oramah, has disclosed that the bank will supply a total of 40",health
Nigeria Names 132 Travellers Who Violated Covid Protocols The Nigerian government has released a second batch of names of travellers who reportedly violated the protocol for international passengers.,health
"Stocks Ride Higher on Democrat Senate Win, Dollar Flounders US Treasuries suffered their steepest selloff in months and the S&P 500 index made a record high after Democrat victories",business
"Omah Lay’s ‘Bad Influence’ Tops Shazam Nigeria 2020 Chart Nigerian singer Omah Lay’s hit single, Bad Influence, was the most searched song of the year by Nigerian listeners on",entertainment
"EASA Certifies Caverton To Commence Training For AW139 Helicopter The European Union Aviation Safety Agency (EASA) has certified Caverton Helicopters, a subsidiary of Caverton Offshore Support Group (COSG), to",business
"Tinubu’s Search for VP Candidate Begins; See the Likely Contenders The emergence, on Wednesday, of a former Lagos State Governor, Asiwaju Bola Ahmed Tinubu, as the presidential candidate of the",politics
"Nigeria: APC, PDP Senators Rally to Pass e-Transmission of Election Results The controversial clause on the electronic transmission of election results as contained in the 2010 Electoral Act (Amendment) Bill 2021,",politics
"Guinea Refuses to Allow Deposed President Conde to Leave the Country Guinea’s military leaders say they will not let deposed President Alpha Conde seek exile, after regional mediators attempted to mount",politics
"Prince Harry and Jennifer Lopez Lead Covid-19 Charity Concert in Los Angeles Prince Harry has called for vaccines to be ""distributed to everyone everywhere"" at a star-studded charity concert in Los Angeles. The",entertainment
Barca Legend Samuel Eto’o Involved in Car Accident in Cameroon Former Barcelona and Inter Milan striker Samuel Eto'o is in stable condition after he was involved in a car accident,sports
"Atiku Appoints Dino Melaye, Daniel Bwala as Spokespersons In preparation for his 2023 election campaign, presidential candidate of the Peple's Democratic Party, Atiku Abubakar on Thursday appointed Senator",politics
"Nigeria Lost $1bn to Crude Oil Theft in Q1 2022 The Chief Executive Officer of the Nigerian Upstream Petroleum Regulatory Commission (NUPRC), Mr. Gbenga Komolafe, has said Nigeria lost about",business
"CBN Guarantees N130bn to Farmers under Agricultural Credit Scheme The Central Bank of Nigeria (CBN) on Thursday said a total of 1,232,326 loans valued at N130.90 billion had been",business
Covid-19: English Football Under Threat as Multiple Matches May Be Postponed Tottenham’s Premier League match against Fulham on Wednesday is under threat after an outbreak of coronavirus at Fulham. Fulham are,sports
"Nigeria: SEC Reverses Self, Suspends Approval of Cryptocurrency-related Products Nigeria's Securities and Exchange Commission has reversed its earlier decision to accept Bitcoin and other cryptocurrencies as securities, suspending the",business
"Nigeria: Opposition PDP Confirms That Its Presidential Ticket Is Thrown Open, Recommends Consensus After some back and forth over a period of time, the National Executive Committee  (NEC) of the Peoples Democratic Party",politics
"No Plan to Withdraw Naira Notes from Circulation, Nigeria’s Central Bank Clarifies The Central Bank of Nigeria (CBN) on Saturday debunked reports that it planned to replace the conventional Naira notes in",business
Elon Musk Says Twitter Legal Team Told Him He Violated an NDA Elon Musk on Saturday tweeted that Twitter Inc's legal team accused him of violating a nondisclosure agreement by revealing that,business
"Veteran Broadcaster Larry King, 87, in Hospital with Covid Veteran broadcaster Larry King has tested positive for coronavirus and is being treated at a hospital in Los Angeles, according",health
"Nigeria: PDP Presents Anambra Guber Certificate to Ozigbo, Says APC Failed Nigerians The National Chairman of the Peoples Democratic Party (PDP), Prince Uche Secondus on Wednesday presented the certificate of return to",politics
"Renowned African Designers Kenneth Ize, Lanre Da Silva, Tiffany Amber, Others to Showcase Designs at Nigeria’s Independence Day Event As Nigeria celebrates the 60th anniversary of its independence on October 1, the THISDAY ARISE Group is hosting a virtual",entertainment
World Champion Tobi Amusan Defends 100m hurdles gold at Commonwealth Games The reigning world champion and record holder successfully defended her Games title at the Alexander stadium on Sunday morning.Read more,sports
"Total, Chevron Suspend Payments to Myanmar Junta from Gas Project French oil and gas group Total and US energy company Chevron have suspended some payments from a gas joint venture",business
"Nigeria: Autopsy Reveals Chemical Intoxication as Cause of Dowen Student Oromoni’s Death An autopsy carried out by the Consultant Pathologist at the Central Hospital Warri, Clement Vhriterhire, has established that Sylvester Oromoni",health
"Johnny Depp Wins Defamation Lawsuit Against Amber Heard, Awarded $15 Million The heated, televised court battle between Johnny Depp and Amber Heard is finally over. On Wednesday, a seven-member jury found",entertainment
"Nigeria’s Sports Ministry, Football Federation Procure 20,000 Tickets for Super Eagles’ Fans Ahead Ghana Match In a bold move to fill up the stands of the Moshood Abiola National Stadium and guarantee high-decibel support for",sports
"Nigeria’s Deputy Petroleum Minister Denies Plans to Increase Fuel Price Nigeria's Minister of State for Petroleum, Timipre Sylva on Friday denied there are plans by the federal government to increase",business
"Preliminary Research Detects ‘Unique’ Covid-19 Variant in Kenya Preliminary research has detected a new variant of the coronavirus in Kenya, with the research carried out by the state-linked",health
Scientists Say India Government Ignored Warnings Amid Coronavirus Surge A forum of scientific advisers set up by the government warned Indian officials in early March of a new and,health
"US MasterChef Junior Star Dies Aged 14 from Rare Cancer MasterChef Junior star Ben Watkins has died aged 14 from a rare form of cancer, his family has confirmed. The",health
China’s Rover Sends Back First Images from Surface of Mars China’s Zhurong rover has sent back its first photographs of the Red Planet after its history-making landing over the weekend.,tech
"Over 600 Journalists have Died of COVID-19 Worldwide, New Report Shows Over 600 journalists have died worldwide due to the Covid-19 pandemic, a new report by the Press Emblem Campaign (PEC)",health
"Despite Signing Electoral Act, Buhari Demands Alteration of Clause Banning Political Appointees Nigeria President Muhammadu Buhari on Friday signed into law the reworked Electoral Act Amendment Bill transmitted to him by the",politics
